<?xml version="1.0" encoding="UTF-8"?>
<xs:schema xmlns:xs="http://www.w3.org/2001/XMLSchema">

    <xs:element name="store">
        <xs:complexType>
            <xs:sequence>
                <xs:element name="order" maxOccurs="unbounded">
                    <xs:complexType>
                        <xs:sequence>
                            <xs:element name="product" maxOccurs="unbounded">
                                <xs:complexType>
                                    <xs:sequence>
                                        <xs:element name="name" type="xs:string" />
                                        <xs:element name="quantity" type="xs:int" />
                                    </xs:sequence>
                                    <xs:attribute name="id" type="xs:ID" use="required" />
                                </xs:complexType>
                            </xs:element>
                        </xs:sequence>

                        <xs:attribute name="id" type="xs:ID" use="required" />
                    </xs:complexType>
                    <!-- "@" dùng để tham chiếu đến thuộc tính, nếu không có @ thì sẽ hiển là 1 phần
                    tử con -->
                    <xs:unique name="uniqueProductID">
                        <xs:selector xpath="product" />
                        <xs:field xpath="@id" />
                    </xs:unique>
                </xs:element>
            </xs:sequence>
        </xs:complexType>

        <xs:unique name="uniqueOrderID">
            <xs:selector xpath="order" />
            <xs:field xpath="@id" />
        </xs:unique>
    </xs:element>

</xs:schema>